popularity,budget,revenue,title,release date,run time,tagline,genre,movies_country
377.045,170000000,1488732821,Top Gun: Maverick,5/24/2022,131,Feel the need... The need for speed.,Action,United States of America
155.786,25000000,105125007,Everything Everywhere All at Once,3/24/2022,140,The universe is so much bigger than you realize.,Action,United States of America
222.382,185000000,770836163,The Batman,3/2/2022,177,Unmask the truth.,Action,United States of America
22.966,63000000,920100000,Jurassic Park,6/11/1993,127,An adventure 65 million years in the making.,Action,United States of America
85.1,6000000,245066411,The Godfather,3/14/1972,175,An offer you can't refuse.,Action,United States of America
343.354,200000000,1916306995,Spider-Man: No Way Home,12/15/2021,148,The Multiverse unleashed.,Action,United States of America
87.357,140000000,655011224,Pirates of the Caribbean: The Curse of the Black Pearl,7/9/2003,143,Prepare to be blown out of the water.,Action,United States of America
107.32,25000000,28341469,The Shawshank Redemption,9/23/1994,142,Fear can hold you prisoner. Hope can set you free.,Action,United States of America
72.302,11000000,775398007,Star Wars,5/25/1977,121,"A long time ago in a galaxy far, far away...",Action,United States of America
243.432,200000000,2187463944,Titanic,11/18/1997,194,Nothing on Earth could come between them.,Action,United States of America
28.166,19000000,61389680,The Goonies,6/7/1985,114,Take the Oath. Join the Adventure.,Action,United States of America
70.441,7000000,34266564,American Psycho,4/13/2000,102,I think my mask of sanity is about to slip.,Action,United States of America
119.69,356000000,2797800564,Avengers: Endgame,4/24/2019,181,Avenge the fallen.,Action,United States of America
29.337,113000000,850000000,Star Wars: Episode III - Revenge of the Sith,5/17/2005,140,The saga is complete.,Action,United States of America
64.562,3300000,13092000,Whiplash,10/10/2014,107,The road to greatness can take you to the edge.,Action,United States of America
76.424,185000000,1004558444,The Dark Knight,7/14/2008,152,Welcome to a world without rules.,Action,United States of America
147.466,165000000,701729206,Interstellar,11/5/2014,169,Mankind was born on Earth. It was never meant to die here.,Action,United States of America
74.335,55000000,1074251311,Joker,10/1/2019,122,Put on a happy face.,Action,United States of America
66.156,40000000,309232797,Knives Out,11/27/2019,131,"Hell, any of them could have done it.",Action,United States of America
43.488,10000000,1600000,CODA,8/11/2021,112,Every family has its own language.,Action,United States of America
46.669,90000000,263920180,The Fifth Element,5/2/1997,126,There is no future without it.,Action,United States of America
20.995,5000000,11800000,Verdens verste menneske,10/13/2021,128,,Action,United States of America
684.853,237000000,2920357254,Avatar,12/15/2009,162,Enter the world of Pandora.,Action,United States of America
51.159,178000000,791657398,Mission: Impossible - Fallout,7/13/2018,147,Some missions are not a choice.,Action,United States of America
78.904,160000000,825532764,Inception,7/15/2010,148,Your mind is the scene of the crime.,Action,United States of America
31.179,90000000,291465000,The Departed,10/4/2006,151,Lies. Betrayal. Sacrifice. How far will you take it?,Action,United States of America
55.425,70000000,481840909,Saving Private Ryan,7/24/1998,169,The mission is a man.,Action,United States of America
38.292,100000000,394638258,1917,12/25/2019,119,Time is the enemy,Action,United States of America
71.054,55000000,677387716,Forrest Gump,6/23/1994,142,The world will never be the same once you've seen it through the eyes of Forrest Gump.,Action,United States of America
30.812,30000000,174600318,The Grand Budapest Hotel,2/26/2014,100,A murder case of Madam D. With enormous wealth and the most outrageous events surrounding her sudden death!,Action,United States of America
56.887,8000000,214179088,Pulp Fiction,9/10/1994,154,Just because you are a character doesn't mean you have character.,Action,United States of America
123.897,100000000,392000000,The Wolf of Wall Street,12/25/2013,180,EARN. SPEND. PARTY.,Action,United States of America
9.93,4500000,7390108,Requiem for a Dream,10/6/2000,102,,Action,United States of America
40.925,60000000,187436818,Heat,12/15/1995,170,A Los Angeles crime saga.,Action,United States of America
61.658,19000000,381109762,Back to the Future,7/3/1985,116,He's the only kid ever to get into trouble before he was born.,Action,United States of America
111.674,150000000,259239658,Blade Runner 2049,10/4/2017,164,The key to the future is finally unearthed.,Action,United States of America
50.788,1300000,28570902,Taxi Driver,2/9/1976,114,"On every street in every city, there's a nobody who dreams of being a somebody.",Action,United States of America
81.18,63000000,100853753,Fight Club,10/15/1999,139,Mischief. Mayhem. Soap.,Action,United States of America
36.857,130000000,185258983,Watchmen,3/4/2009,163,Justice is coming to all of us.  No matter what we do.,Action,United States of America
51.908,13000000,102600000,The Godfather Part II,12/20/1974,202,"I don't feel I have to wipe everybody out, Tom. Just my enemies.",Action,United States of America
25.261,30000000,296187079,Ghostbusters,6/8/1984,107,They ain't afraid of no ghost.,Action,United States of America
56.744,70000000,321457747,Inglourious Basterds,8/19/2009,153,Once upon a time in Nazi occupied France...,Action,United States of America
84.672,93000000,871368364,The Lord of the Rings: The Fellowship of the Ring,12/18/2001,179,One ring to rule them all,Action,United States of America
10.631,19000000,272742922,The Silence of the Lambs,2/14/1991,119,To enter the mind of a killer she must challenge the mind of a madman.,Action,United States of America
207.755,300000000,2046239637,Avengers: Infinity War,4/25/2018,149,An entire universe. Once and for all.,Action,United States of America
19.732,40000000,227300000,Paddington 2,11/9/2017,104,It takes a bear to catch a thief,Action,United States of America
50.398,2777000,33754967,The Wizard of Oz,8/15/1939,102,"We're off to see the Wizard, the wonderful Wizard of Oz!",Action,United States of America
80.016,180000000,853977126,Thor: Ragnarok,10/24/2017,131,No Hammer. No Problem.,Action,United States of America
24.85,25000000,56505065,Tombstone,12/25/1993,130,Justice is coming.,Action,United States of America
38.27,20000000,53000000,Edward Scissorhands,12/5/1990,105,His scars run deep.,Action,United States of America
94.858,58000000,783100000,Deadpool,2/9/2016,108,Witness the beginning of a happy ending.,Action,United States of America
39.753,52000000,903992901,Bohemian Rhapsody,10/24/2018,135,Fearless lives forever,Action,United States of America
34.422,170000000,772776600,Guardians of the Galaxy,7/30/2014,121,All heroes start somewhere.,Action,United States of America
52.919,11000000,104931801,Alien,5/25/1979,117,In space no one can hear you scream.,Action,United States of America
48.674,100000000,425368238,Django Unchained,12/25/2012,165,"Life, liberty and the pursuit of vengeance.",Action,United States of America
47.138,33000000,327311859,Se7en,9/22/1995,127,Seven deadly sins. Seven ways to die.,Action,United States of America
52.76,15000000,98267558,Predator,6/12/1987,107,Soon the hunt will begin.,Action,United States of America
49.71,61000000,369330363,Gone Girl,10/1/2014,149,You don't know what you've got 'til it's...,Action,United States of America
41.504,4500000,255407969,Get Out,2/24/2017,104,"Just because you're invited, doesn't mean you're welcome.",Action,United States of America
28.82,31500000,150000000,Apocalypse Now,8/15/1979,147,This is the end...,Action,United States of America
25.822,18000000,538400000,The Empire Strikes Back,5/20/1980,124,The Adventure Continues...,Action,United States of America
54.374,81000000,414351546,Kingsman: The Secret Service,12/13/2014,129,Manners maketh man.,Action,United States of America
91.247,63000000,463517383,The Matrix,3/30/1999,136,Welcome to the Real World.,Action,United States of America
49.37,103000000,465361176,Gladiator,5/4/2000,155,A Hero Will Rise.,Action,United States of America
18.341,1000000,51525171,The Breakfast Club,2/15/1985,98,"They only met once, but it changed their lives forever.",Action,United States of America
167.329,40000000,175302354,Hacksaw Ridge,10/7/2016,139,One of the greatest heroes in American history never fired a bullet.,Action,United States of America
35.582,23000000,47351251,Her,12/18/2013,126,A Spike Jonze Love Story,Action,United States of America
59.265,250000000,1081041287,The Dark Knight Rises,7/16/2012,165,The Legend Ends,Action,United States of America
76.608,150000000,378858340,Mad Max: Fury Road,5/13/2015,121,What a Lovely Day.,Action,United States of America
31.786,30000000,5472914,Once Upon a Time in America,5/23/1984,229,"Crime, passion and lust for power.",Action,United States of America
41.551,46000000,122126687,Prisoners,9/18/2013,153,Every moment matters.,Action,United States of America
52.318,4000000,41063475,Call Me by Your Name,9/1/2017,132,Is it better to speak or die?,Action,United States of America
43.093,97600000,225508210,Ford v Ferrari,11/13/2019,153,They took the American dream for a ride,Action,United States of America
24.471,159000000,968853,The Irishman,11/1/2019,209,His story changed history,Action,United States of America
29.192,13000000,329398046,Black Swan,12/3/2010,108,,Action,United States of America
28.595,30000000,46357676,Full Metal Jacket,6/26/1987,117,"Vietnam can kill me, but it can’t make me care.",Action,United States of America
141.53,250000000,954305868,Harry Potter and the Deathly Hallows: Part 1,10/6/2010,146,One Way… One Fate… One Hero.,Action,United States of America
34.896,25000000,171627166,No Country for Old Men,6/13/2007,122,There are no clean getaways.,Action,United States of America
21.606,40000000,243240178,A Few Good Men,12/11/1992,138,"In the heart of the nation's capital, in a courthouse of the U.S. government, one man will stop at nothing to keep his honor, and one will stop at nothing to find the truth.",Action,United States of America
63.012,200000000,863756051,Guardians of the Galaxy Vol. 2,4/19/2017,137,Obviously.,Action,United States of America
16.897,0,600000,Scarface,4/9/1932,93,The rise and fall of a power hungry mobster.,Action,United States of America
47.687,28000000,41722424,Blade Runner,6/25/1982,118,Man has made his match... now it's his problem.,Action,United States of America
42.55,18500000,183316455,Aliens,7/18/1986,137,This time it's war.,Action,United States of America
49.387,80000000,294800000,Shutter Island,2/14/2010,138,Some places never let you go.,Action,United States of America
19.528,50000000,110206216,Moneyball,9/23/2011,134,What are you really worth?,Action,United States of America
73.644,110000000,786365638,Deadpool 2,5/10/2018,120,Prepare for the Second Coming.,Action,United States of America
86.84,90000000,375540831,Spider-Man: Into the Spider-Verse,12/14/2018,117,More than one wears the mask.,Action,United States of America
20.837,8000000,52287414,Stand by Me,8/8/1986,89,"For some, it's the last real taste of innocence, and the first real taste of life.",Action,United States of America
18.836,16000000,30861665,The Princess Bride,9/25/1987,99,It's as real as the feelings you feel.,Action,United States of America
78.976,60000000,286801374,The Green Mile,12/10/1999,189,Miracles do happen.,Action,United States of America
30.459,14000000,82468705,Jojo Rabbit,10/18/2019,108,An anti-hate satire.,Action,United States of America
27.315,350000,1000000,12 Angry Men,4/10/1957,97,Life is in their hands. Death is on their minds.,Action,United States of America
39.368,150000000,599045960,Casino Royale,11/14/2006,144,Everyone has a past. Every legend has a beginning.,Action,United States of America
19.572,15000000,34533783,In Bruges,2/8/2008,108,Shoot first. Sightsee later.,Action,United States of America
39.004,28000000,121616555,Pride & Prejudice,9/16/2005,127,A romance ahead of its time.,Action,United States of America
47.419,178000000,370541256,Edge of Tomorrow,5/27/2014,114,Live. Die. Repeat.,Action,United States of America
83.059,94000000,1118888979,The Lord of the Rings: The Return of the King,12/1/2003,201,The eye of the enemy is moving.,Action,United States of America
90.701,54000000,136766062,The Godfather Part III,12/25/1990,170,All the power on earth can't change destiny.,Action,United States of America
186.305,150000000,895921036,Harry Potter and the Goblet of Fire,11/16/2005,157,Dark And Difficult Times Lie Ahead.,Action,United States of America
24.825,40000000,109676311,The Prestige,10/19/2006,130,Are You Watching Closely?,Action,United States of America
31.474,100000000,527000000,Dunkirk,7/19/2017,107,Survival is Victory,Action,United States of America
153.813,125000000,1341511219,Harry Potter and the Deathly Hallows: Part 2,7/7/2011,130,It all ends here.,Action,United States of America
22.423,15000000,356296601,American Beauty,9/15/1999,122,Look closer.,Action,United States of America
26.705,6000000,30000000,Chinatown,6/20/1974,130,You get tough. You get tender. You get close to each other. Maybe you even get close to the truth.,Action,United States of America
29.149,16400000,235860116,Dead Poets Society,6/2/1989,128,He was their inspiration. He made their lives extraordinary.,Action,United States of America
46.151,18000000,389925971,Raiders of the Lost Ark,6/12/1981,115,Indiana Jones - the new hero from the creators of JAWS and STAR WARS.,Action,United States of America
40.724,15000000,78054825,Drive,9/15/2011,100,There are no clean getaways.,Action,United States of America
14.268,0,32416586,The Sandlot,4/7/1993,101,,Action,United States of America
61.894,60000000,264118201,The Truman Show,6/4/1998,103,On the air. Unaware.,Action,United States of America
46.549,6400000,78371200,The Terminator,10/26/1984,108,Your future is in its hands.,Action,United States of America
11.055,0,0,Out of the Past,11/25/1947,97,A MAN - Trying to run away from his past... A WOMAN - Trying to escape her future...,Action,United States of America
35.617,19000000,44781695,The Shining,5/23/1980,144,"He came as the caretaker, but this hotel had its own guardians - who'd been there a long time",Action,United States of America
32.177,2200000,26589000,A Clockwork Orange,12/19/1971,137,"Being the adventures of a young man whose principal interests are rape, ultra-violence and Beethoven.",Action,United States of America
19.037,25000000,77208711,There Will Be Blood,12/26/2007,158,There Will Be Greed. There Will Be Vengeance.,Action,United States of America
24.807,3500000,83453539,Airplane!,7/2/1980,88,"What's slower than a speeding bullet, and able to hit tall buildings at a single bound?",Action,United States of America
30.886,10500000,792965500,E.T. the Extra-Terrestrial,6/11/1982,115,He is afraid. He is alone. He is three million light years from home.,Action,United States of America
101.591,30000000,373554033,Toy Story,10/30/1995,81,,Action,United States of America
43.656,150000000,374218673,Batman Begins,6/10/2005,140,Evil fears the knight.,Action,United States of America
26.504,60000000,313542341,A Beautiful Mind,12/11/2001,135,He saw the world in a way no one could have imagined.,Action,United States of America
12.478,10000000,50100000,The Longest Day,9/25/1962,178,This is the day that changed the world... when history held its breath.,Action,United States of America
73.573,140000000,585174222,Iron Man,4/30/2008,126,Heroes aren't born. They're built.,Action,United States of America
37.879,23600000,102391540,Zombieland,10/7/2009,88,Nut up or shut up.,Action,United States of America
20.483,30000000,131016624,Atonement,9/7/2007,123,Torn apart by betrayal. Separated by war. Bound by love.,Action,United States of America
62.664,10000000,225933435,Good Will Hunting,12/5/1997,127,"For the first 20 years of his life, Will Hunting has called the shots. Now he's about to meet his match.",Action,United States of America
25.337,6000000,23341568,The Usual Suspects,7/19/1995,106,Five Criminals. One Line Up. No Coincidence.,Action,United States of America
118.783,45000000,763455561,The Lion King,6/23/1994,89,Life's greatest adventure is finding your place in the Circle of Life.,Action,United States of America
123.535,220000000,1518815515,The Avengers,4/25/2012,143,Some assembly required.,Action,United States of America
19.5,8200000,286214286,The Sound of Music,3/29/1965,174,The happiest sound in all the world!,Action,United States of America
33.82,7000000,470653000,Jaws,6/20/1975,124,Don't go in the water,Action,United States of America
37.473,150000000,385680446,Star Trek,5/6/2009,127,The future begins.,Action,United States of America
58.566,20000000,170812526,Superbad,3/20/2007,113,Come and get some!,Action,United States of America
29.962,40000000,672806292,The Sixth Sense,8/6/1999,107,Not every gift is a blessing.,Action,United States of America
34.832,12000000,87100449,About Time,9/4/2013,123,What if every moment in life came with a second chance?,Action,United States of America
18.514,6000000,8618766,Blue Velvet,1/1/1986,120,It's a strange world.,Action,United States of America
31.295,40000000,216601214,Little Women,12/25/2019,135,Own your story,Action,United States of America
38.497,150000000,335802786,The Curious Case of Benjamin Button,12/25/2008,166,"Life isn't measured in minutes, but in moments.",Action,United States of America
61.832,20000000,72258126,Eternal Sunshine of the Spotless Mind,3/19/2004,108,You can erase someone from your mind. Getting them out of your heart is another story.,Action,United States of America
24.137,52000000,116112375,Casino,11/22/1995,179,No one stays at the top forever.,Action,United States of America
23.871,10000000,10827810,Office Space,2/19/1999,90,Work sucks.,Action,United States of America
29.037,6000000,138530565,Platoon,12/19/1986,120,The first casualty of war is innocence.,Action,United States of America
90.96,25000000,235956898,Hidden Figures,12/10/2016,127,"Meet the women you don't know, behind the mission you do.",Action,United States of America
23.538,15000000,46969409,The Big Lebowski,3/6/1998,117,Times like these call for a Big Lebowski.,Action,United States of America
72.124,35000000,469310836,The Hangover,6/2/2009,100,Some guys just can't handle Vegas.,Action,United States of America
14.603,0,0,Hamilton,7/3/2020,160,An American Musical.,Action,United States of America
68.973,102000000,520000000,Terminator 2: Judgment Day,7/3/1991,137,It's nothing personal.,Action,United States of America
40.68,200000000,1108569499,Skyfall,10/24/2012,143,Think on your sins.,Action,United States of America
39.472,135000000,532950503,The Revenant,12/25/2015,157,"(n. One who has returned, as if from the dead.)",Action,United States of America
24.413,11000000,44998252,Wind River,8/3/2017,107,Nothing is harder to track than the truth.,Action,United States of America
44.105,30000000,84872444,Sicario,9/17/2015,122,The border is just another line to cross.,Action,United States of America
43.692,14000000,233555708,The Imitation Game,11/14/2014,113,The true enigma was the man who cracked the code.,Action,United States of America
19.841,4000000,16491080,Trainspotting,2/23/1996,94,Choose life.,Action,United States of America
29.152,140000000,456758981,The Last Samurai,12/5/2003,154,"In the face of an enemy, in the heart of one man, lies the soul of a warrior.",Action,United States of America
33.203,40000000,244931766,Love Actually,9/7/2003,135,The Ultimate Romantic Comedy.,Action,United States of America
60.922,52000000,352114312,Catch Me If You Can,12/16/2002,141,The true story of a real fake.,Action,United States of America
19.796,15000000,43101594,Boogie Nights,10/7/1997,156,"The life of a dreamer, the days of a business, and the nights in between.",Action,United States of America
19.91,150000000,690860472,Moana,10/13/2016,107,The ocean is calling.,Action,United States of America
40.025,6000000,7500000,Donnie Darko,10/24/2001,114,"28 days, 6 hours, 42 minutes, 12 seconds... that is when the world will end.",Action,United States of America
48.523,15000000,441405644,The Exorcist,12/26/1973,122,"Something almost beyond comprehension is happening to a girl on this street, in this house… and a man has been sent for as a last resort. This man is The Exorcist.",Action,United States of America
17.078,2239000,10000000,Sabrina,9/10/1954,113,...the chauffeur's daughter who learned her stuff in Paris,Action,United States of America
108.716,150000000,623726000,Ratatouille,6/28/2007,111,He's dying to become a chef.,Action,United States of America
68.484,29000000,115603229,The Notebook,6/25/2004,123,Behind every great love is a great story.,Action,United States of America
28.418,9000000,39723096,Memento,10/11/2000,113,Some memories are best forgotten.,Action,United States of America
59.391,1200000,25253887,"Il buono, il brutto, il cattivo",12/23/1966,161,For three men the Civil War wasn't hell. It was practice.,Action,United States of America
86.322,150000000,1023784195,Zootopia,2/11/2016,109,Welcome to the urban jungle.,Action,United States of America
70.116,25000000,216639112,The Help,8/9/2011,146,Change begins with a whisper.,Action,United States of America
14.184,25000000,93617009,The Fighter,12/10/2010,116,Every dream deserves a fighting chance.,Action,United States of America
36.307,72000000,213216216,Braveheart,3/14/1995,178,Every man dies. Not every man truly lives.,Action,United States of America
22.667,6000000,21029340,The Father,12/23/2020,96,,Action,United States of America
36.702,30000000,180906076,Kill Bill: Vol. 1,10/10/2003,111,A roaring rampage of revenge.,Action,United States of America
23.312,28000000,133346506,The Big Short,12/11/2015,131,This is a true story.,Action,United States of America
78.955,250000000,1153337496,Captain America: Civil War,4/27/2016,147,United we stand. Divided we fall.,Action,United States of America
168.419,130000000,789804554,Harry Potter and the Prisoner of Azkaban,5/31/2004,141,Something wicked this way comes.,Action,United States of America
75.605,79000000,926287400,The Lord of the Rings: The Two Towers,12/18/2002,179,A New Power Is Rising.,Action,United States of America
48.22,15000000,60629159,The Fly,8/15/1986,96,Be afraid. Be very afraid.,Action,United States of America
39.941,47000000,203388186,Arrival,11/10/2016,116,Why are they here?,Action,United States of America
23.17,102000000,358372926,Minority Report,6/20/2002,145,The system is perfect until it comes after you.,Action,United States of America
28.195,13000000,33400000,The Perks of Being a Wallflower,9/20/2012,103,We are infinite.,Action,United States of America
28.595,3300000,30641770,Cidade de Deus,2/5/2002,130,"If you run, the beast catches you; if you stay, the beast eats you.",Action,United States of America
22.694,12500000,12600000,True Romance,9/9/1993,120,"Stealing, cheating, killing. Who said romance was dead?",Action,United States of America
42.72,8500000,50300000,Nightcrawler,10/23/2014,118,The city shines brightest at night,Action,United States of America
27.508,40000000,224920315,The Social Network,10/1/2010,121,You don't get to 500 million friends without making a few enemies.,Action,United States of America
62.933,97000000,619021436,Logan,2/28/2017,137,His time has come.,Action,United States of America
26.523,10000000,83557872,Snatch,9/1/2000,103,Stealin' stones and breakin' bones.,Action,United States of America
32.182,20000000,23875127,American History X,7/1/1998,119,Some Legacies Must End.,Action,United States of America
35.802,23000000,319700000,Green Book,11/16/2018,130,Inspired by a True Friendship,Action,United States of America
44.755,3000000,4000000,Willy Wonka & the Chocolate Factory,6/29/1971,100,It's Scrumdidilyumptious!,Action,United States of America
21.144,26000000,71870729,"O Brother, Where Art Thou?",8/30/2000,107,They have a plan... but not a clue.,Action,United States of America
17.051,16000000,92823546,When Harry Met Sally...,7/21/1989,96,Can two friends sleep together and still love each other in the morning?,Action,United States of America
15.953,35000000,124909762,Donnie Brasco,2/27/1997,127,Based on a true story.,Action,United States of America
19.986,25000000,354825435,Rain Man,12/11/1988,134,A journey through understanding and fellowship.,Action,United States of America
17.86,3800000,18309793,Jagten,10/25/2012,116,The lie is spreading.,Action,United States of America
29.191,1200000,2859750,Reservoir Dogs,9/2/1992,99,Every dog has his day.,Action,United States of America
13.739,1600000,6263224,What We Do in the Shadows,6/19/2014,86,Some interviews with some vampires,Action,United States of America
17.433,60000000,47386287,Almost Famous,9/15/2000,122,Experience it. Enjoy it. Just don't fall for it.,Action,United States of America
44.962,108000000,630161890,The Martian,9/30/2015,141,Bring Him Home,Action,United States of America
34.629,92000000,172989651,Black Hawk Down,12/28/2001,145,Leave No Man Behind.,Action,United States of America
34.465,28000000,140767956,Die Hard,7/15/1988,131,Twelve terrorists. One cop. The odds are against John McClane... That's just the way he likes it.,Action,United States of America
23.975,44000000,155760117,The Hateful Eight,12/25/2015,188,No one comes up here without a damn good reason.,Action,United States of America
18.177,7000000,60611975,Fargo,3/8/1996,98,A lot can happen in the middle of nowhere.,Action,United States of America
27.151,5000000,23123592,Captain Fantastic,7/8/2016,118,He Prepared Them for Everything Except the Outside World.,Action,United States of America
53.851,35000000,0,Bound by Honor,2/5/1993,190,An epic story of three brothers. Bound by blood. Divided by fate. Driven by destiny.,Action,United States of America
34.077,15000000,19629760,The Thing,6/25/1982,109,Man is The Warmest Place to Hide.,Action,United States of America
