popularity,budget,revenue,title,release date,run time,tagline,genre,movies_country
45.045,10000000,17287898,A Bronx Tale,9/14/1993,121,"One man lives in the neighborhood, another man owns it.",Action,United States of America
20.364,5000000,11990401,Nuovo Cinema Paradiso,11/17/1988,124,An enchanted village. A wonderful friendship. Star-crossed lovers. And the magic of the movies.,Action,United States of America
12.711,15000000,85306374,Match Point,10/26/2005,124,Passion Temptation Obsession.,Action,United States of America
13.663,40000000,165478348,Bridge of Spies,10/15/2015,141,"In the shadow of war, one man showed the world what we stood for.",Action,United States of America
38.115,93000000,482860185,Rise of the Planet of the Apes,8/3/2011,105,Evolution Becomes Revolution.,Action,United States of America
17.435,26000000,206678440,Philadelphia,12/22/1993,126,No one would take on his case... until one man was willing to take on the system.,Action,United States of America
22.088,2500000,124881062,Goldfinger,9/20/1964,110,Everything he touches turns into excitement!,Action,United States of America
13.724,3600000,44785053,Midnight Cowboy,5/25/1969,113,For those who have never seen it and those who have never forgotten it.,Action,United States of America
11.999,11000000,198992,Barry Lyndon,11/26/1975,185,At long last Redmond Barry became a gentleman—and that was his tragedy.,Action,United States of America
12.9,10000000,16680836,Dogville,5/19/2003,178,A quiet little town not far from here.,Action,United States of America
29.02,13000000,33750478,La piel que habito,8/17/2011,120,,Action,United States of America
14.235,52000000,98126565,The Thin Red Line,12/25/1998,171,Every man fights his own war.,Action,United States of America
13.274,4000000,48137666,Boyhood,6/5/2014,166,12 years in the making.,Action,United States of America
18.057,35000000,66700000,Empire of the Sun,12/9/1987,153,"To survive in a world at war, he must find a strength greater than all the events that surround him.",Action,United States of America
22.721,20000000,306889114,Close Encounters of the Third Kind,11/18/1977,137,We are not alone,Action,United States of America
18.023,28000000,186797986,Walk the Line,9/13/2005,136,Love is a burning thing.,Action,United States of America
17.647,13000000,22863596,Being John Malkovich,10/29/1999,113,Ever wanted to be someone else? Now you can.,Action,United States of America
70.236,37000000,173567581,Creed,11/25/2015,133,Your legacy is more than a name,Action,United States of America
18.71,6000000,102308889,Butch Cassidy and the Sundance Kid,1/15/1969,111,"Not that it matters, but most of it is true.",Action,United States of America
14.439,2000000,33965843,El secreto de sus ojos,8/13/2009,130,,Action,United States of America
14.307,40000000,205405498,JFK,12/20/1991,189,The story that won't go away.,Action,United States of America
11.105,6500000,37295445,Do the Right Thing,6/14/1989,120,"It's the hottest day of the summer. You can do nothing, you can do something, or you can …",Action,United States of America
25.73,2000000,4905000,The Magnificent Seven,10/12/1960,128,They were seven - And they fought like seven hundred!,Action,United States of America
44.978,12000000,60000000,Spartacus,10/13/1960,197,They trained him to kill for their pleasure ... but they trained him a little too well,Action,United States of America
14.509,17000000,72661442,My Fair Lady,10/21/1964,170,The loverliest motion picture of them all!,Action,United States of America
15.692,7000000,48126384,End of Watch,9/20/2012,109,Every moment of your life they stand watch,Action,United States of America
12.048,2700000,15992615,Before Sunset,2/10/2004,80,What if you had a second chance with the one that got away?,Action,United States of America
15.67,2500000,11500000,The Birds,3/28/1963,119,"...and remember, the next scream you hear may be your own!",Action,United States of America
15.245,55000000,218791811,Captain Phillips,10/10/2013,134,Out here survival is everything.,Action,United States of America
16.722,11000000,119418501,Fried Green Tomatoes,12/27/1991,130,The secret of life? The secret's in the sauce.,Action,United States of America
19.961,18000000,26828365,Glory,12/15/1989,122,Their innocence. Their heritage. Their lives.,Action,United States of America
15.655,19000000,32801173,Adaptation.,12/6/2002,115,"From the creator of Being John Malkovich, comes the story about the creator of Being John Malkovich.",Action,United States of America
58.459,170000000,710644566,Dawn of the Planet of the Apes,6/26/2014,130,One last chance for peace.,Action,United States of America
20.959,75000000,288500217,The Bourne Supremacy,7/23/2004,108,They should have left him alone.,Action,United States of America
11.303,927262,2500000,Double Indemnity,6/14/1944,107,It's love and murder at first sight!,Action,United States of America
57.796,4000000,205843612,The Jungle Book,10/18/1967,78,The Jungle is JUMPIN'!,Action,United States of America
22.654,200000,14500000,Per un pugno di dollari,1/18/1964,99,"In his own way he is perhaps, the most dangerous man who ever lived!",Action,United States of America
15.752,15000000,146292000,The Color Purple,12/18/1985,154,It's about life. It's about love. It's about us.,Action,United States of America
17.302,5500000,159616327,The Sting,12/25/1973,129,...all it takes is a little confidence.,Action,United States of America
13.772,4000000,38251425,Annie Hall,4/19/1977,93,A nervous romance.,Action,United States of America
15.497,200000,0,The Man from Earth,6/10/2007,87,From one of the acclaimed writers of Star Trek and The Twilight Zone comes a story that transcends both time and space...,Action,United States of America
59.195,24000000,75634409,The Nightmare Before Christmas,10/9/1993,76,"This is Halloween, everybody make a scene!",Action,United States of America
10.261,22000000,77737889,Gandhi,11/30/1982,191,His triumph changed the world forever.,Action,United States of America
16.962,5000000,26010864,The Elephant Man,10/9/1980,124,I am not an animal! I am a human being! I … am … a man!,Action,United States of America
15.324,4500000,10609321,After Hours,9/13/1985,97,"When it's after midnight in New York City, you don't have to look for love, laughter and trouble. They'll all find you!",Action,United States of America
28.835,70000000,442824138,The Bourne Ultimatum,8/3/2007,115,Remember everything. Forgive nothing.,Action,United States of America
16.408,4000000,20745728,Life of Brian,8/17/1979,94,He wasn't the messiah. He was a very naughty boy.,Action,United States of America
18.769,12000000,53267000,Papillon,12/13/1973,151,The greatest adventure of escape!,Action,United States of America
39.3,90000000,366101666,Die Hard: With a Vengeance,5/19/1995,128,Think fast. Look alive. Die hard.,Action,United States of America
17.913,1300000,650422,Metropolis,2/6/1927,149,There can be no understanding between the hands and the brain unless the heart acts as mediator.,Action,United States of America
11.145,1600000,4420000,The Conversation,4/7/1974,113,Harry Caul is an invader of privacy. The best in the business.,Action,United States of America
12.089,0,0,M - Eine Stadt sucht einen Mörder,5/11/1931,109,Who is the murderer?,Action,United States of America
20.876,48000000,207515725,Traffic,3/23/2000,147,No one gets away clean,Action,United States of America
48.046,70000000,23159305,The Iron Giant,8/6/1999,86,It came from outer space!,Action,United States of America
66.938,1488423,184925486,Snow White and the Seven Dwarfs,12/21/1937,83,"The Happiest, Dopiest, Grumpiest, Sneeziest movie of the year.",Action,United States of America
12.635,9000000,17096053,Rushmore,12/11/1998,93,Love. Expulsion. Revolution.,Action,United States of America
66.859,145000000,621537500,How to Train Your Dragon 2,6/5/2014,102,The training is over.,Action,United States of America
8.792,2500000,30900000,Paper Moon,5/9/1973,102,These aren't everyday people and this is no ordinary movie.,Action,United States of America
21.086,5000000,109280263,Billy Elliot,9/28/2000,110,Inside every one of us is a special talent waiting to come out. The trick is finding it.,Action,United States of America
9.775,3000000,11176469,Before Midnight,4/5/2013,109,Everything's better with maturity.,Action,United States of America
10.352,1300000,29133000,The Last Picture Show,10/3/1971,119,"Anarene, Texas, 1951. Nothing much has changed…",Action,United States of America
10.546,13000000,65796862,In the Name of the Father,12/12/1993,133,Falsely accused. Wrongly imprisoned. He fought for justice to clear his father’s name.,Action,United States of America
28.738,4000000,27007072,Relatos salvajes,8/21/2014,122,We can all lose control,Action,United States of America
13.698,750000,0,La montaña sagrada,11/29/1973,114,,Action,United States of America
30.488,18000000,35692920,127 Hours,11/12/2010,94,There is no force more powerful than the will to live.,Action,United States of America
18.048,62770198,64241499,Isle of Dogs,3/23/2018,101,Welcome to the Isle of Dogs.,Action,United States of America
12.288,4000000,10785801,Låt den rätte komma in,10/24/2008,115,Eli is 12 years old. She’s been 12 for over 200 years and she just moved in next door.,Action,United States of America
8.721,1300000,3483000,White Heat,9/2/1949,114,"Pick up the pieces folks, Jimmy's in action again!",Action,United States of America
14.377,1800000,41158757,The French Connection,10/9/1971,104,There are no rules and no holds barred when Popeye cuts loose!,Action,United States of America
14.519,6000000,44734660,The Wrestler,9/7/2008,109,Love. Pain. Glory.,Action,United States of America
11.873,20000000,2536000,The King of Comedy,12/18/1982,109,It's No Laughing Matter.,Action,United States of America
19.038,600000,15000000,Per qualche dollaro in più,12/18/1965,132,"The man with no name is back... the man in black is waiting... a walking arsenal - he uncoils, strikes and kills!",Action,United States of America
8.943,1200000,34100000,Sling Blade,8/30/1996,135,A simple man. A difficult choice.,Action,United States of America
12.495,3000000,25000000,The Apartment,6/21/1960,125,"Movie-wise, there has never been anything like it - laugh-wise, love-wise, or otherwise-wise!",Action,United States of America
9.695,0,57663224,Diarios de motocicleta,2/6/2004,126,,Action,United States of America
16.017,1746964,2181987,"Paris, Texas",8/23/1984,145,A place for dreams. A place for heartbreak. A place to pick up the pieces.,Action,United States of America
17.581,2500000,50700000,Bonnie and Clyde,7/18/1967,110,They’re young… they’re in love… and they kill people.,Action,United States of America
17.482,0,0,Det sjunde inseglet,2/16/1957,96,The Story of a Challenge to Death.,Action,United States of America
21.842,650000,55000000,Dawn of the Dead,9/2/1978,127,"When there’s no more room in HELL, the dead will walk the EARTH!",Action,United States of America
13.497,18000,8811,Das Cabinet des Dr. Caligari,2/27/1920,78,You must become Caligari!,Action,United States of America
10.557,3000000,29800000,Serpico,12/18/1973,130,Many of his fellow officers considered him the most dangerous man alive - An honest cop.,Action,United States of America
9.747,980000,0,What Ever Happened to Baby Jane?,10/12/1962,135,"Sister Sister, Oh So Fair! Why Is There Blood All Over Your Hair?",Action,United States of America
13.713,20000000,60427839,21 Grams,9/6/2003,124,How much does life weigh?,Action,United States of America
11.893,0,1681521,Detachment,4/24/2011,98,,Action,United States of America
20.543,3200000,16217773,Cool Hand Luke,6/22/1967,127,What we've got here is failure to communicate.,Action,United States of America
13.184,90000000,60289912,The Insider,10/28/1999,158,Two men driven to tell the truth … whatever the cost.,Action,United States of America
35.116,114000,30000000,Night of the Living Dead,10/4/1968,96,"If it doesn't scare you, you're already dead!",Action,United States of America
12.176,910000,9600000,On the Waterfront,6/22/1954,108,The man lived by the jungle law of the docks!,Action,United States of America
10.343,12400000,24164400,La grande bellezza,5/21/2013,142,,Action,United States of America
12.733,25000000,34698685,October Sky,2/19/1999,108,Sometimes one dream is enough to light up the whole sky.,Action,United States of America
11.533,1530000,7267585,Lola rennt,3/3/1998,81,Every second of every day you're faced with a decision that can change your life.,Action,United States of America
11.885,30000000,3669465,The Fall,1/1/2006,117,A little blessing in disguise.,Action,United States of America
7.889,226408,1423000,The Thin Man,5/25/1934,91,A laugh tops every thrilling moment!,Action,United States of America
14.11,12500000,10725228,Glengarry Glen Ross,9/15/1992,100,Lie. Cheat. Steal. All in a day’s work.,Action,United States of America
12.699,15000000,34604000,Mississippi Burning,12/8/1988,128,1964. When America was at war with itself.,Action,United States of America
25.072,1000000,75462037,Searching,8/24/2018,102,No one is lost without a trace.,Action,United States of America
16.73,2000000,27379978,In the Heat of the Night,8/2/1967,109,They got a murder on their hands. They don’t know what to do with it.,Action,United States of America
11.549,1288000,6000000,Rebecca,3/23/1940,130,The shadow of this woman darkened their love.,Action,United States of America
17.911,3700000,31800000,The Outlaw Josey Wales,7/14/1976,135,...an army of one.,Action,United States of America
17.498,0,0,Persona,10/18/1966,83,,Action,United States of America
13.706,3800000,23689877,Network,11/14/1976,122,Television will never be the same.,Action,United States of America
8.962,1650000,30500000,From Here to Eternity,8/28/1953,118,Pouring out of impassioned pages...brawling their way to greatness on the screen!,Action,United States of America
7.37,6000000,54766923,Ordinary People,9/19/1980,124,Everything is in its proper place... except the past.,Action,United States of America
11.881,15000000,1140769,Roma,8/25/2018,135,There are periods in history that scar societies and moments in life that transform us as individuals.,Action,United States of America
20.007,1500000,12000000,Roman Holiday,8/26/1953,119,Romance in romantic Rome!,Action,United States of America
4.024,2380000,8176544,This Is England,9/12/2006,101,"Run with the crowd, stand alone, you decide.",Action,United States of America
12.641,13500000,19255873,La migliore offerta,1/1/2013,131,A Master of Possession. A Crime of Obsession,Action,United States of America
15.205,11500000,23237911,The Remains of the Day,11/5/1993,134,Diamond in the Rough.,Action,United States of America
13.383,935000,0,Paths of Glory,10/25/1957,88,It explodes in the no-man's land no picture ever dared cross before!,Action,United States of America
10.286,27575,3151130,Clerks,9/13/1994,92,Just because they serve you doesn't mean they like you.,Action,United States of America
16.391,17500000,38000000,Hotel Rwanda,3/4/2004,121,"When the world closed its eyes, he opened his arms.",Action,United States of America
10.743,0,0,Belle de jour,5/24/1967,101,Luis Bunuel's Masterpiece of Erotica!,Action,United States of America
7.838,12000000,27682872,Nebraska,9/21/2013,115,Life's not about winning or losing. It's about how you get there in the end.,Action,United States of America
13.239,3200000,8000000,The Man Who Shot Liberty Valance,4/15/1962,123,Two great stars together for the first time!,Action,United States of America
15.155,0,19647000,La dolce vita,2/5/1960,176,The world’s most talked about movie today!,Action,United States of America
10.097,12000000,22244207,Pink Floyd: The Wall,7/14/1982,95,The Memories... The Madness... The Music... The Movie.,Action,United States of America
22.344,10000000,21485066,Enter the Dragon,8/17/1973,102,Their deadly mission: to crack the forbidden island of Han!,Action,United States of America
13.606,3000000,10000000,Judgment at Nuremberg,12/18/1961,179,We have to forgive if we are to go on living.,Action,United States of America
10.82,6000000,0,Cabaret,2/13/1972,124,Life is a Cabaret.,Action,United States of America
11.163,4000000,13475000,Charade,12/5/1963,113,Is anyone really who they seem to be?,Action,United States of America
14.986,4000000,13624522,Sing Street,3/11/2016,106,Boy meets girl. Girl unimpressed. Boy starts band.,Action,United States of America
12.316,730000,8000000,High Noon,6/9/1952,85,The story of a man who was too proud to run.,Action,United States of America
24.008,22000000,92542418,I Am Sam,12/28/2001,132,Love is all you need.,Action,United States of America
10.51,1750000,3800000,The Quiet Man,7/21/1952,129,Action... Excitement... Romance... Fill the Screen!,Action,United States of America
11.618,1400000,8400000,All About Eve,10/6/1950,139,It's all about women... and their men!,Action,United States of America
7.877,0,0,Days of Heaven,9/13/1978,94,Your eyes... Your ears... Your senses... will be overwhelmed.,Action,United States of America
13.358,8000000,106260000,Kramer vs. Kramer,12/7/1979,105,There are three sides to this love story,Action,United States of America
13.738,3750000,0,The Searchers,5/7/1956,119,He had to find her... he had to find her...,Action,United States of America
21.249,34000000,48169908,Malcolm X,11/18/1992,202,,Action,United States of America
12.955,8000000,39187783,50/50,9/30/2011,100,It takes a pair to beat the odds.,Action,United States of America
27.631,21000000,83137603,"South Park: Bigger, Longer & Uncut",6/30/1999,81,UH-OH.,Action,United States of America
14.174,4900000,3494070,Mommy,9/19/2014,138,Loving people doesn't save them.,Action,United States of America
11.527,0,0,8½,2/14/1963,139,A picture that goes beyond what men think about - because no man ever thought about it in quite this way!,Action,United States of America
10.872,1600000,4900000,The Big Sleep,8/23/1946,114,The picture they were born for!,Action,United States of America
15.528,88000000,108539911,Cinderella Man,6/2/2005,144,One man's extraordinary fight to save the family he loved.,Action,United States of America
8.931,450000,0,Badlands,10/15/1973,94,Burning Love on the Great Plains in 1959!,Action,United States of America
22.687,27000000,56308881,Lucky Number Slevin,2/24/2006,110,Wrong Time. Wrong Place. Wrong Number.,Action,United States of America
24.447,0,0,Klaus,11/8/2019,96,Welcome to the jingle,Action,United States of America
13.557,3000000,9000000,Witness for the Prosecution,12/17/1957,116,The most electrifying entertainment of our time!,Action,United States of America
12.115,0,1608570,Once Were Warriors,9/2/1994,99,"A family in crisis, a life in chaos... Nothing is more powerful than a mother's love.",Action,United States of America
34.343,14000000,1755212,Flipped,8/6/2010,89,You never forget your first love.,Action,United States of America
15.955,1500000,199963,Rebel Without a Cause,10/29/1955,111,The bad boy from a good family.,Action,United States of America
14.029,12800000,40031879,Dancer in the Dark,6/30/2000,141,You don't need eyes to see.,Action,United States of America
7.464,0,0,Spoorloos,10/27/1988,106,Who Has Seen This Woman?,Action,United States of America
16.966,23000000,43984230,The Last Emperor,10/4/1987,163,"1500 slaves. 353,260,000 royal subjects. Warlords. Concubines. And 2 wives. He was the loneliest boy in the world.",Action,United States of America
11.849,12000000,89800000,Patton,1/25/1970,172,The Rebel Warrior,Action,United States of America
12.751,2000000,7600000,The Hustler,9/25/1961,134,They called him Fast Eddie. He was a winner. He was a loser. He was a hustler.,Action,United States of America
16.045,40000000,124731534,Ray,10/29/2004,152,The extraordinary life story of Ray Charles.,Action,United States of America
16.493,1500000,0,Modern Times,2/5/1936,87,"He stands alone as the greatest entertainer of modern times! No one on earth can make you laugh as heartily or touch your heart as deeply...the whole world laughs, cries and thrills to his priceless genius!",Action,United States of America
10.656,3000000,2807390,Happiness,10/16/1998,139,Finding happiness can be a tragic comedy.,Action,United States of America
19.688,672000,10000000,King Kong,3/15/1933,104,A Monster of Creation’s Dawn Breaks Loose in Our World Today!,Action,United States of America
18.659,2000000,11000000,The Great Dictator,10/15/1940,125,Once again - the whole world laughs!,Action,United States of America
11.824,0,0,Me and Earl and the Dying Girl,6/12/2015,105,A Little Friendship Never Killed Anyone.,Action,United States of America
17.451,21000000,26768563,Zwartboek,9/14/2006,145,"To fight the enemy, she must become one of them.",Action,United States of America
11.963,9000000,6153939,Barton Fink,8/1/1991,117,What's in his head,Action,United States of America
13.682,6000000,48618191,The Last King of Scotland,1/12/2006,123,Charming. Magnetic. Murderous.,Action,United States of America
11.507,1720000,8000000,Zulu,1/22/1964,138,Dwarfing the mightiest! Towering over the greatest!,Action,United States of America
9.394,2100000,23650000,The Best Years of Our Lives,12/25/1946,171,Three wonderful loves in the best picture of the year!,Action,United States of America
16.238,19000000,68673228,Letters from Iwo Jima,12/19/2006,141,The battle of Iwo Jima seen through the eyes of the Japanese soldiers.,Action,United States of America
16.565,1400000,3000000,Dial M for Murder,5/29/1954,105,If a woman answers... hang on for dear life!,Action,United States of America
13.764,15000000,133432856,The Artist,10/12/2011,100,A breath of fresh vintage air,Action,United States of America
12.818,2900000,370720,Abre los ojos,12/19/1997,117,,Action,United States of America
14.169,375000,1772000,The Maltese Falcon,10/18/1941,100,A story as EXPLOSIVE as his BLAZING automatics!,Action,United States of America
21.372,55000000,168167691,Seven Pounds,12/18/2008,123,Seven names. Seven strangers. One secret.,Action,United States of America
11.353,9000000,83304330,Fiddler on the Roof,11/3/1971,181,To Life!,Action,United States of America
12.187,0,6110979,Short Cuts,9/5/1993,187,Short Cuts raises the roof on America.,Action,United States of America
10.233,1200000,7000000,Strangers on a Train,6/27/1951,101,It starts with a shriek of a train whistle... and ends with shrieking excitement!,Action,United States of America
12.355,0,0,East of Eden,4/10/1955,115,The searing classic of paradise lost!,Action,United States of America
14.603,0,1226098,The Third Man,8/31/1949,104,Hunted by men ... Sought by WOMEN!,Action,United States of America
13.187,1500000,2200000,Rope,3/11/1948,81,The guest who's dead on time.,Action,United States of America
9.276,12000000,37823676,All That Jazz,12/16/1979,123,All that work. All that glitter. All that pain. All that love. All that crazy rhythm. All that jazz.,Action,United States of America
12.43,291000,12000000,Frankenstein,11/19/1931,70,The man who made a monster,Action,United States of America
8.209,0,3803298,Breaking the Waves,5/13/1996,159,Love is a mighty power.,Action,United States of America
25.922,60000000,76249438,Kubo and the Two Strings,8/18/2016,102,The quest begins,Action,United States of America
13.609,10000000,6203044,The Straight Story,10/15/1999,112,"A true story that proves a little determination goes a very, very long way.",Action,United States of America
26.711,0,0,Togo,12/20/2019,113,The untold true story.,Action,United States of America
9.315,645180,14743391,My Left Foot: The Story of Christy Brown,4/7/1989,103,"A film about life, laughter, and the occasional miracle.",Action,United States of America
9.83,0,30177511,Being There,12/19/1979,130,Getting there is half the fun; being there is all of it!,Action,United States of America
12.788,0,64803131,Hable con ella,3/15/2002,112,,Action,United States of America
17.695,8900000,29844753,Amour,9/20/2012,127,,Action,United States of America
15.673,531374,1103757,Stagecoach,3/3/1939,96,A powerful story of nine strange people.,Action,United States of America
7.67,325000,4500000,It Happened One Night,2/22/1934,105,Together for the first time!,Action,United States of America
11.688,3300000,20653717,A Christmas Story,11/18/1983,93,"Peace, Harmony, Comfort and Joy... Maybe Next Year.",Action,United States of America
8.461,2200000,10,Nashville,6/11/1975,160,The damnedest thing you ever saw.,Action,United States of America
8.302,0,0,The Philadelphia Story,12/5/1940,113,Broadway's howling year-run comedy hit of the snooty society beauty who slipped and fell - IN LOVE!,Action,United States of America
9.659,1200000,1500000,To Be or Not to Be,3/5/1942,99,Hollywood's Happiest Star in the Picture You Must Not Miss!,Action,United States of America
8.534,0,0,Hamlet,12/25/1996,242,,Action,United States of America
10.617,160000,20710513,Once,3/23/2007,85,How often do you find the right person?,Action,United States of America
12.02,2200000,7700000,The Manchurian Candidate,10/1/1962,126,"When you've seen it all, you'll swear there's never been anything like it!",Action,United States of America
11.805,6000000,6795771,Fanny och Alexander,12/17/1982,188,,Action,United States of America
11.637,2500000,3210139,Der Himmel über Berlin,5/17/1987,128,There are angels on the streets of Berlin.,Action,United States of America
12.368,3800000,4307000,The Treasure of the Sierra Madre,1/15/1948,126,"The nearer they get to their treasure, the farther they get from the law.",Action,United States of America
11.001,1200000,0,Harold and Maude,12/20/1971,91,They were meant to be. But exactly what they were meant to be is not quite clear.,Action,United States of America
10.12,1000000,2300000,Short Term 12,8/23/2013,96,Support them. Take care of them. But don't become their friend.,Action,United States of America
18.75,7700000,21000000,Where Eagles Dare,12/4/1968,155,"One weekend Major Smith, Lieutenant Schaffer, and a beautiful blonde named Mary decided to win World War II.",Action,United States of America
