popularity,budget,revenue,title,release date,run time,tagline,genre,movies_country
24.426,15000000,56255142,Into the Wild,9/11/2007,148,Into the heart. Into the soul.,Action,United States of America
32.509,90000000,429632142,Cast Away,12/22/2000,143,"At the edge of the world, his journey begins.",Action,United States of America
21.599,50000000,109423648,The Game,9/12/1997,129,What do you get for the man who has everything?,Action,United States of America
15.352,37000000,48451803,Magnolia,12/10/1999,189,"Things fall down. People look up. And when it rains, it pours.",Action,United States of America
88.505,29000000,309208309,The Blind Side,11/20/2009,129,Based on the extraordinary true story,Action,United States of America
15.125,0,30692889,En man som heter Ove,12/25/2015,116,,Action,United States of America
67.729,250000000,1021103568,The Hobbit: An Unexpected Journey,11/26/2012,169,From the smallest beginnings come the greatest legends.,Action,United States of America
22.822,5000000,33616692,Y tu mamá también,6/8/2001,106,Life has its ways of teaching.,Action,United States of America
35.263,12000000,71923560,2001: A Space Odyssey,4/2/1968,149,The Ultimate Trip.,Action,United States of America
53.06,92000000,631442092,The Incredibles,10/27/2004,115,"No gut, no glory",Action,United States of America
33.384,14000000,178043761,Brokeback Mountain,9/10/2005,134,Love is a force of nature,Action,United States of America
32.992,20000000,230098753,La vita è bella,12/20/1997,116,"An unforgettable fable that proves love, family and imagination conquer all.",Action,United States of America
40.001,30000000,447407695,La La Land,11/29/2016,129,Here's to the fools who dream.,Action,United States of America
55.1,25000000,226830568,Taken,2/18/2008,94,They took his daughter.  He'll take their lives.,Action,United States of America
41.408,40000000,332000000,Back to the Future Part II,11/22/1989,108,"Roads? Where we're going, we don't need roads!",Action,United States of America
55.579,40000000,120654337,Apocalypto,12/7/2006,139,No one can outrun their destiny.,Action,United States of America
17.957,90000000,232617430,The Girl with the Dragon Tattoo,12/14/2011,158,Evil shall with evil be expelled.,Action,United States of America
69.159,175000000,1073394593,Toy Story 4,6/19/2019,100,Get Ready to Hit the Road,Action,United States of America
17.375,25000000,156822020,Mystic River,1/1/2003,138,"We bury our sins, we wash them clean.",Action,United States of America
76.953,94000000,940335536,Finding Nemo,5/30/2003,100,There are 3.7 trillion fish in the ocean. They're looking for one.,Action,United States of America
32.774,806947,0,Psycho,6/22/1960,109,A new—and altogether different—screen excitement!,Action,United States of America
26.451,38000000,90247624,Rush,9/2/2013,123,Everyone's driven by something.,Action,United States of America
31.126,35000000,120072577,The Pianist,9/17/2002,150,Music was his passion. Survival was his masterpiece.,Action,United States of America
15.997,13000000,35401758,Room,10/16/2015,118,Love knows no boundaries,Action,United States of America
37.685,36000000,433888866,A Star Is Born,9/20/2018,136,,Action,United States of America
21.101,25000000,76270454,The Untouchables,6/3/1987,119,What are you prepared to do?,Action,United States of America
7.674,0,7523634,Pride,9/12/2014,122,Based on the inspirational true story.,Action,United States of America
29.541,13000000,96060858,The Butterfly Effect,1/17/2004,113,Change one thing. Change everything.,Action,United States of America
17.217,17000000,151119219,Midnight in Paris,5/11/2011,94,,Action,United States of America
17.514,44500000,232325503,Argo,3/22/2012,120,The movie was fake. The mission was real.,Action,United States of America
122.333,115000000,579707738,"Monsters, Inc.",11/1/2001,92,We Scare Because We Care.,Action,United States of America
23.729,40000000,158733820,Sin City,4/1/2005,124,Walk down the right back alley in Sin City and you can find anything...,Action,United States of America
197.12,60000000,487853320,Shrek,5/18/2001,90,The greatest fairy tale never told.,Action,United States of America
84.027,175000000,857611174,Inside Out,6/9/2015,95,Meet the little voices inside your head.,Action,United States of America
11.63,8000000,100523181,Little Miss Sunshine,7/26/2006,102,A family on the verge of a breakdown,Action,United States of America
2.099,18000000,476684675,Home Alone,11/16/1990,103,A family comedy without the family.,Action,United States of America
26.443,20000000,187000000,12 Years a Slave,10/18/2013,134,The extraordinary true story of Solomon Northup,Action,United States of America
41.211,28000000,96188903,Kick-Ass,3/22/2010,117,Shut up. Kick-Ass.,Action,United States of America
14.138,2600000,119500000,Blazing Saddles,2/7/1974,93,Never give a saga an even break!,Action,United States of America
27.413,65000000,84785914,Zodiac,3/2/2007,157,There's more than one way to lose your life to a killer.,Action,United States of America
18.122,12000000,37589296,Hell or High Water,8/11/2016,102,Blood always follows money.,Action,United States of America
112.327,175000000,800526015,Coco,10/27/2017,105,The celebration of a lifetime,Action,United States of America
20.74,5150000,21700000,Druk,9/24/2020,117,What a life.,Action,United States of America
17.745,18000000,2300000,Marriage Story,9/28/2019,137,"Where there's a love, there's a way.",Action,United States of America
37.689,15000000,125212904,First Blood,10/22/1982,93,This time he's fighting for his life.,Action,United States of America
31.264,45000000,104876233,Training Day,10/5/2001,122,"The only thing more dangerous than the line being crossed, is the cop who will cross it.",Action,United States of America
49.441,1000000,117250402,Rocky,11/21/1976,120,His whole life was a million-to-one shot.,Action,United States of America
18.89,70000000,123218424,Big Fish,12/25/2003,125,An adventure as big as life itself.,Action,United States of America
22.983,12000000,80573774,Hot Fuzz,2/14/2007,121,Big cops. Small town. Moderate violence.,Action,United States of America
18.976,35000000,126216940,L.A. Confidential,9/19/1997,138,Everything is suspect... Everyone is for sale... And nothing is what it seems.,Action,United States of America
24.275,21000000,236412453,Silver Linings Playbook,11/16/2012,122,Watch For The Signs,Action,United States of America
22.006,14400000,159157447,Unforgiven,8/7/1992,130,Some legends will never be forgotten. Some wrongs can never be forgiven.,Action,United States of America
39.665,29000000,168841459,Twelve Monkeys,12/29/1995,129,The future is history.,Action,United States of America
91.773,90000000,497366869,Toy Story 2,10/30/1999,92,The toys are back!,Action,United States of America
69.77,7500000,60781545,(500) Days of Summer,7/17/2009,95,This is not a love story. This is a story about love.,Action,United States of America
15.619,5000000,55736588,Dallas Buyers Club,11/1/2013,117,Sometimes it takes a hustler to change the world,Action,United States of America
17.343,0,5800000,Rio Bravo,3/17/1959,141,They fought back to back... No quarter given... No quarter asked... No way in... No way out... of Rio Bravo!,Action,United States of America
15.824,16000000,68263166,Moonrise Kingdom,5/16/2012,94,A tormenting and surprising story of children and adults during the stormy days of the summer of 1965.,Action,United States of America
28.245,15000000,120207127,Lethal Weapon,3/6/1987,110,If these two can learn to stand each other... the bad guys don't stand a chance.,Action,United States of America
80.046,175000000,735099082,Up,5/28/2009,96,,Action,United States of America
24.327,17000000,209947037,The Others,8/2/2001,101,Sooner or later they’ll find you.,Action,United States of America
18.977,15000000,160192031,"Three Billboards Outside Ebbing, Missouri",12/1/2017,115,,Action,United States of America
77.477,150000000,136384442,Soul,12/25/2020,101,Is all this living really worth dying for?,Action,United States of America
25.823,6100000,30097092,Shaun of the Dead,4/9/2004,99,A romantic comedy. With zombies.,Action,United States of America
19.305,18000000,51973029,Amadeus,9/19/1984,160,Everything you've heard is true...,Action,United States of America
33.386,22000000,424208848,Dances with Wolves,3/30/1990,181,Inside everyone is a frontier waiting to be discovered.,Action,United States of America
46.248,25000000,23308615,Warrior,9/9/2011,140,Family is worth fighting for.,Action,United States of America
37.037,170000000,714766572,Captain America: The Winter Soldier,3/20/2014,136,In heroes we trust.,Action,United States of America
22.596,878000,10462500,Casablanca,11/26/1942,102,They had a date with fate in Casablanca!,Action,United States of America
8.441,9000000,39946780,Manhattan,4/25/1979,96,,Action,United States of America
31.719,9000000,70000000,3 Idiots,12/23/2009,170,Aal Izz Well!,Action,United States of America
63.271,165000000,494878759,How to Train Your Dragon,3/18/2010,98,One adventure will change two worlds,Action,United States of America
56.217,180000000,521311860,WALL·E,6/22/2008,98,"After 700 years of doing what he was built for, he'll discover what he was meant for.",Action,United States of America
20.152,2500000,5987386,Before Sunrise,1/27/1995,101,Can the greatest romance of your life last only one night?,Action,United States of America
10.546,1350000,28356188,"Lock, Stock and Two Smoking Barrels",8/28/1998,105,A Disgrace to Criminals Everywhere.,Action,United States of America
35.795,48000000,474171806,Indiana Jones and the Last Crusade,5/24/1989,127,"The man with the hat is back. And this time, he's bringing his Dad.",Action,United States of America
20.434,44000000,368875760,The Fugitive,8/6/1993,131,A murdered wife. A one-armed man. An obsessed detective. The chase begins.,Action,United States of America
26.371,70000000,329803958,Who Framed Roger Rabbit,6/21/1988,104,"It's the story of a man, a woman, and a rabbit in a triangle of trouble.",Action,United States of America
24.132,4000000,402352579,Gone with the Wind,12/15/1939,238,The greatest romance of all time!,Action,United States of America
23.82,45000000,186003591,Inside Man,3/17/2006,129,It looked like the perfect bank robbery. But you can’t judge a crime by its cover.,Action,United States of America
45.318,1200000,103911669,Saw,10/1/2004,103,Live or die. Make your choice.,Action,United States of America
30.947,325000,70274000,Halloween,10/24/1978,91,The Night He Came Home!,Action,United States of America
23.35,36000000,12532777,Gattaca,9/7/1997,106,There is no gene for the human spirit.,Action,United States of America
28.025,15000000,50000000,The Deer Hunter,3/9/1978,183,,Action,United States of America
19.906,5740000,9923127,Portrait de la jeune fille en feu,6/17/2019,120,Don't regret. Remember.,Action,United States of America
14.737,70000000,137515140,Stardust,8/9/2007,127,This Summer A Star Falls. The Chase Begins.,Action,United States of America
25.754,13000000,53424681,RoboCop,7/17/1987,102,Part man. Part machine. All cop. The future of law enforcement.,Action,United States of America
60.131,69000000,533679475,Despicable Me,7/8/2010,95,Superbad. Superdad.,Action,United States of America
88.645,165000000,657827828,Big Hero 6,10/24/2014,102,From the creators of Wreck-It Ralph and Frozen.,Action,United States of America
103.732,260000000,592461732,Tangled,11/24/2010,100,They're taking adventure to new lengths.,Action,United States of America
71.462,130000000,631744560,Kung Fu Panda,6/4/2008,90,Prepare for awesomeness.,Action,United States of America
16.082,55000000,113020255,Changeling,1/30/2008,141,"To find her son, she did what no one else dared.",Action,United States of America
14.384,3000000,104945305,The Graduate,12/21/1967,106,This is Benjamin. He’s a little worried about his future.,Action,United States of America
19.897,40000000,75505856,The Last of the Mohicans,8/26/1992,112,The first American hero.,Action,United States of America
18.144,1800000,9523464,Dr. Strangelove or: How I Learned to Stop Worrying and Love the Bomb,1/29/1964,95,The hot-line suspense comedy.,Action,United States of America
52.379,250000000,747862775,X-Men: Days of Future Past,5/15/2014,132,"To save the future, they must alter the past.",Action,United States of America
9.438,6244087,638641,The Wild Bunch,6/17/1969,145,Unchanged men in a changing land,Action,United States of America
20.381,15000000,378410542,Slumdog Millionaire,11/12/2008,120,What does it take to find a lost love?,Action,United States of America
69.71,200000000,1066969703,Toy Story 3,6/16/2010,103,No toy gets left behind.,Action,United States of America
24.081,76000000,70595464,Children of Men,9/22/2006,109,The future's a thing of the past.,Action,United States of America
22.474,52000000,355237933,Apollo 13,6/30/1995,140,"Houston, we have a problem.",Action,United States of America
35.107,70000000,130293714,Man on Fire,4/23/2004,146,"Creasy's art is death, and he is about to paint his masterpiece.",Action,United States of America
13.845,6000000,50000000,The Boondock Saints,1/22/1999,108,Thy Kingdom Come. Thy Will Be Done.,Action,United States of America
61.602,28000000,504050219,Aladdin,11/25/1992,90,Wish granted!,Action,United States of America
21.6,15000000,69995385,Lawrence of Arabia,12/11/1962,228,A mighty motion picture of action and adventure!,Action,United States of America
16.663,20000000,98690254,Spotlight,11/6/2015,129,Break the story. Break the silence.,Action,United States of America
23.567,0,13601384,Dark Waters,11/22/2019,127,The truth has a man on the inside,Action,United States of America
27.261,100000000,266465037,American Gangster,11/2/2007,157,There are two sides to the American dream,Action,United States of America
27.837,60000000,214034224,The Bourne Identity,6/14/2002,119,He was the perfect weapon until he became the target.,Action,United States of America
21.86,30000000,136706683,Remember the Titans,9/29/2000,113,History is written by the winners.,Action,United States of America
21.113,80000000,181001478,Road to Perdition,7/12/2002,117,Pray for Michael Sullivan.,Action,United States of America
15.413,5000000,8203235,The Machinist,2/9/2004,101,How do you wake up from a nightmare if you’re not asleep?,Action,United States of America
90.785,60000000,124600000,Coraline,2/5/2009,100,Enter a world beyond your wildest dreams... and nightmares,Action,United States of America
19.168,27000000,115229890,The Blues Brothers,6/16/1980,133,They're on a mission from God.,Action,United States of America
74.496,25000000,424967620,Beauty and the Beast,10/22/1991,84,The most beautiful love story ever told.,Action,United States of America
32.88,100000000,171720398,Blood Diamond,12/7/2006,143,It will cost you everything.,Action,United States of America
35.604,30000000,210819611,District 9,8/5/2009,112,You are not welcome here.,Action,United States of America
13.012,11000000,64088552,My Cousin Vinny,3/13/1992,120,"Truth, Justice and the Gambini Way.",Action,United States of America
43.018,28000000,201634991,Straight Outta Compton,8/11/2015,147,The Story of N.W.A.,Action,United States of America
57.362,200000000,1242805359,Incredibles 2,6/14/2018,118,Back to work.,Action,United States of America
15.404,11000000,111858363,Doctor Zhivago,12/22/1965,200,"Turbulent were the times and fiery was the love story of Zhivago, his wife and the passionate, tender Lara.",Action,United States of America
54.713,250000000,958400000,The Hobbit: The Desolation of Smaug,12/11/2013,161,Beyond darkness... beyond desolation... lies the greatest danger of all.,Action,United States of America
25.822,30000000,216763646,Million Dollar Baby,12/15/2004,132,"Beyond his silence, there is a past. Beyond her dreams, there is a feeling. Beyond hope, there is a memory. Beyond their journey, there is a love.",Action,United States of America
31.506,2800000,86273333,Young Frankenstein,12/15/1974,106,The scariest comedy of all time!,Action,United States of America
56.908,14000000,307166834,The Fault in Our Stars,5/16/2014,126,,Action,United States of America
21.507,30000000,102616183,Primal Fear,3/6/1996,129,"Sooner or later, a man who wears two faces forgets which one is real.",Action,United States of America
31.578,190000000,467365246,Star Trek Into Darkness,5/5/2013,132,Earth Will Fall,Action,United States of America
27.807,6800000,6788659,Incendies,9/4/2010,131,The search began at the opening of their mother's will.,Action,United States of America
25.741,14600000,71074049,Groundhog Day,2/11/1993,101,"He’s having the worst day of his life … over, and over …",Action,United States of America
33.862,18000000,103215094,Birdman or (The Unexpected Virtue of Ignorance),10/17/2014,120,,Action,United States of America
18.859,50000000,314178011,As Good as It Gets,12/19/1997,139,A comedy from the heart that goes for the throat. Brace yourself for Melvin.,Action,United States of America
11.509,27000000,21500000,The Right Stuff,10/20/1983,193,How the future began.,Action,United States of America
83.799,40000000,211343479,The Little Mermaid,11/17/1989,83,Somewhere under the sea and beyond your imagination is an adventure in fantasy.,Action,United States of America
19.374,4000000,119723856,Lost in Translation,9/18/2003,102,Everyone wants to be found.,Action,United States of America
13.593,18339750,92180910,Der Untergang,9/16/2004,156,"April 1945, a nation awaits its... Downfall",Action,United States of America
22.428,33000000,269958228,Gran Torino,12/9/2008,116,Ever come across somebody you shouldn't have f#cked with?,Action,United States of America
16.286,400000,1940906,Monty Python and the Holy Grail,5/25/1975,91,And now! At Last! Another film completely different from some of the other films which aren't quite the same as this one is.,Action,United States of America
15.38,51500000,56106607,Eastern Promises,9/14/2007,101,Every sin leaves a mark.,Action,United States of America
9.119,2500000,4736202,This Is Spinal Tap,5/4/1984,82,Prepare to crank those amps up to eleven,Action,United States of America
12.365,25000000,116766556,Finding Neverland,10/17/2004,106,Where will your imagination take you?,Action,United States of America
27.378,60000000,469160692,The Lego Movie,2/6/2014,100,The story of a nobody who saved everybody.,Action,United States of America
18.877,9000000,78988148,Manchester by the Sea,11/18/2016,138,,Action,United States of America
11.038,2000000,46122355,Deliverance,8/18/1972,109,What did happen on the Cahulawassee River?,Action,United States of America
17.771,38000000,252276927,True Grit,12/22/2010,110,Punishment Comes One Way or Another.,Action,United States of America
14.629,35000000,107423,The Trial of the Chicago 7,9/25/2020,130,"In 1968, democracy refused to back down.",Action,United States of America
17.507,39000000,38869464,Serenity,9/23/2005,119,They aim to misbehave.,Action,United States of America
16.912,14000000,85000000,Das Boot,9/17/1981,150,When the hunters become the hunted.,Action,United States of America
15.014,2500000,23915910,Hunt for the Wilderpeople,3/31/2016,101,Nature just got gangster,Action,United States of America
27.934,30000000,152159461,Kill Bill: Vol. 2,4/16/2004,136,The bride is back for the final cut.,Action,United States of America
18.552,5000000,9760104,Moon,6/12/2009,97,The last place you'd ever expect to find yourself.,Action,United States of America
18.183,20000000,61276872,Misery,11/30/1990,107,"Paul Sheldon used to write for a living. Now, he’s writing to stay alive.",Action,United States of America
16.936,25000000,40903593,Falling Down,2/26/1993,113,A Tale Of Urban Reality.,Action,United States of America
30.06,6000000,103082380,Mary Poppins,12/17/1964,139,It's supercalifragilisticexpialidocious!,Action,United States of America
39.123,20000000,305937718,Wonder,11/13/2017,113,Who gives you the courage to face the world?,Action,United States of America
19.15,18000000,23000000,Raging Bull,11/14/1980,129,,Action,United States of America
28.709,2000000,20908467,Amores perros,6/16/2000,154,Love. Betrayal. Death.,Action,United States of America
14.71,1800000,8000000,A Streetcar Named Desire,9/18/1951,125,"...Blanche, who wanted so much to stay a lady...",Action,United States of America
17.506,2000000,13129846,To Kill a Mockingbird,12/20/1962,129,A father must expose his children to a small town's outraged passions… and can only protect them with his love.,Action,United States of America
14.976,21000000,71441250,The Royal Tenenbaums,10/5/2001,110,Family Isn't A Word ... It's A Sentence.,Action,United States of America
23.829,40000000,46471023,Fantastic Mr. Fox,10/23/2009,87,Dig the life fantastic!,Action,United States of America
11.518,18000000,5887457,Ed Wood,9/27/1994,127,"When it came to making bad movies, Ed Wood was the best.",Action,United States of America
19.064,24000000,182016617,The Bridges of Madison County,5/28/1995,135,The path of Francesca Johnson's future seems destined due to an unexpected fork in the road...,Action,United States of America
32.926,120000000,609016565,Life of Pi,11/20/2012,127,Believe The Unbelievable,Action,United States of America
11.95,16000000,134582776,Sense and Sensibility,12/13/1995,136,Lose your heart and come to your senses.,Action,United States of America
87.568,90000000,304320254,Mulan,6/18/1998,88,Courage. Family. Honor.,Action,United States of America
15.794,4000000,35976000,Dirty Harry,12/23/1971,102,Detective Harry Callahan. He doesn't break murder cases. He smashes them.,Action,United States of America
14.989,12000000,96800000,Star Trek II: The Wrath of Khan,6/4/1982,113,At the end of the universe lies the beginning of vengeance.,Action,United States of America
14.462,19000000,34619699,Gone Baby Gone,6/6/2007,113,Everyone wants the truth... until they find it.,Action,United States of America
62.076,165000000,471222889,Wreck-It Ralph,11/1/2012,101,The story of a regular guy just looking for a little wreck-ognition.,Action,United States of America
22.098,35000000,75395048,The Count of Monte Cristo,1/23/2002,131,Prepare for adventure. Count on revenge.,Action,United States of America
22.277,15000000,123726688,The Theory of Everything,11/26/2014,123,His Mind Changed Our World. Her Love Changed His.,Action,United States of America
39.119,55000000,307077295,The Pursuit of Happyness,12/14/2006,117,,Action,United States of America
17.09,1000000,37034514,Rear Window,8/1/1954,112,It only takes one witness to spoil the perfect crime.,Action,United States of America
14.834,55000000,70016220,3:10 to Yuma,9/6/2007,122,Time waits for one man.,Action,United States of America
19.211,839727,23218000,Citizen Kane,4/17/1941,119,It's terrific!,Action,United States of America
27.363,3500000,10900000,Evil Dead II,3/13/1987,84,,Action,United States of America
18.24,12000000,140312928,Lion,11/24/2016,118,The search begins,Action,United States of America
21.444,4000000,11744471,The Great Escape,6/20/1963,173,Put a fence in front of these men... and they'll climb it!,Action,United States of America
15.335,1800000,46665856,Dog Day Afternoon,8/1/1975,125,"Anything can happen during the dog days of summer. On August 22nd, 1972, everything did.",Action,United States of America
14.819,3000000,44908000,The Bridge on the River Kwai,10/11/1957,161,It spans a whole new world of entertainment!,Action,United States of America
17.334,5400000,45300000,The Dirty Dozen,6/15/1967,150,Train them! Excite them! Arm them!...Then turn them loose on the Nazis!,Action,United States of America
8.562,0,0,Naked,9/14/1993,131,When unbalance leads to submission,Action,United States of America
31.072,105000000,723192705,Gravity,10/3/2013,91,Don't Let Go,Action,United States of America
21.142,31000000,134095253,Scent of a Woman,12/23/1992,156,Col. Frank Slade has a very special plan for the weekend.,Action,United States of America
18.867,2883848,25000000,Some Like It Hot,3/19/1959,122,Marilyn Monroe and her bosom companions... Tony Curtis... Jack Lemmon...,Action,United States of America
19.726,4000000,13275000,North by Northwest,7/8/1959,136,"A 2000 MILE CHASE . . . That blazes a trail of TERROR to a gripping, spine-chilling climax !",Action,United States of America
29.321,50000000,72617068,Lord of War,9/16/2005,122,"Where there's a will, there's a weapon",Action,United States of America
38.031,6500000,57504069,Boyz n the Hood,7/12/1991,112,Once upon a time in South Central L.A... It ain't no fairy tale.,Action,United States of America
18.977,15000000,9900000,Brazil,2/20/1985,143,It's only a state of mind.,Action,United States of America
35.932,5800000,32589624,Planet of the Apes,2/7/1968,112,"Somewhere in the Universe, there must be something better than man!",Action,United States of America
16.581,47000000,2331721,Mr. Nobody,11/6/2009,141,"Nothing is real, everything is possible.",Action,United States of America
43.923,13000000,122700000,The Ten Commandments,10/5/1956,220,The Greatest Event in Motion Picture History,Action,United States of America
21.906,12000000,78756177,The Naked Gun: From the Files of Police Squad!,12/2/1988,86,"You've read the ad, now see the movie!",Action,United States of America
21.927,2000000,24600832,Mad Max 2,12/24/1981,96,"When all that's left is one last chance, pray that he's still out there ... somewhere!",Action,United States of America
8.893,795000,0,The Night of the Hunter,8/26/1955,93,"The wedding night, the anticipation, the kiss, the knife, BUT ABOVE ALL...THE SUSPENSE!",Action,United States of America
16.611,0,52096475,Awakenings,12/4/1990,120,There is no such thing as a simple miracle.,Action,United States of America
28.609,15000000,164000000,Ben-Hur,11/18/1959,222,The entertainment experience of a lifetime.,Action,United States of America
23.682,2479000,7797728,Vertigo,5/28/1958,128,Alfred Hitchcock engulfs you in a whirlpool of terror and tension!,Action,United States of America
29.689,27000000,27200316,Dark City,2/27/1998,100,A world where the night never ends.,Action,United States of America
